n,id,unique_views,tag,good,created,bookmarked,t,content
1750,ilr108mp9ta255,72,euchre,0,2016-03-13T20:41:00Z,5,1470666822059,when developing in an ide which toolchain should we use for this class for autocompletion and error checking i have the options of cross gcc cygwin gcc linux gcc macosx gcc microsoft visual studio c mingw gcc and solaris gcc
1749,ilqy431pbcc6rf,91,euchre,0,2016-03-13T19:20:00Z,4,1470666822296,when testing our overridden operator for card can we use ostringstream to capture the output the spec doesnt say we could include sstream
1746,ilqw9z4se9u4j8,102,euchre,0,2016-03-13T18:28:36Z,4,1470666822989,if you are interested in pairing up as partners for this project contact me at takellumichedu
1744,ilquwu0et8917b,179,euchre,0,2016-03-13T17:50:23Z,3,1470666823468,do we have to test whether the player is created according to the correcting strategy or not
1743,ilqswa97n0c2tu,265,euchre,1,2016-03-13T16:53:58Z,5,1470666823650,the playerh file does not define the child classes so do we have full freedom in naming its functions and necessary variables if we do are the functions helper functions to be declared static
1737,ilpzckaqfsr45t,327,euchre,1,2016-03-13T03:06:49Z,9,1470666824511,do we get to choose however we want to use readpack as it has no rme if yes do we have to test it since it is a private function anyway
1736,ilpz8qnzqum6uy,138,euchre,0,2016-03-13T03:03:51Z,5,1470666824745,i obtain the following error message when trying to test my cardcpp file bool cardoperatorconst card const card must take exactly one argument i understand this would be the case if i defined this operator and the other similar operators inside the card class but this was not done nor was it done by me as they were given to us in the cardh file what am i missing in terms of why the compiler thinks only one argument can be passed to be interpreted by the operator thanks
1734,ilpvm4qo7du3q6,71,euchre,0,2016-03-13T01:22:17Z,3,1470666825295,may we freely print to cout for testing
1733,ilpv5ddjigf6l2,199,euchre,0,2016-03-13T01:09:15Z,5,1470666825517,will it be there in the directory when the autograder is evaluating test cases
1731,ilpscp6oqsw753,79,euchre,0,2016-03-12T23:50:58Z,3,1470666825979,whenever i cout cards in a loop which is possible because of the operational overload i get an infinite loop
1730,ilpq8ijyvqh5zi,170,euchre,0,2016-03-12T22:51:44Z,3,1470666826247,does the pack actually refer to the cards member array also if that is the case do we start adding cards from the index 0 or from the last index
1729,ilpq0yi78y51mr,103,euchre,0,2016-03-12T22:45:51Z,4,1470666826484,i got an announcement that this is posted on our google drive but i dont see it in the project 4 folder or any other folder do we use the same sheet as last time
1728,ilpocsr2htk1wy,119,euchre,0,2016-03-12T21:59:05Z,4,1470666826754,requires rank is one of two three four five six seven eight nine ten jack queen king ace suit is one of spades hearts clubs diamonds effects initializes card to specified rank and suit cardconst stdstring rankin const stdstring suitin should the private member rank be one of two three four etc or rankin be one of two three four etc
1726,ilpk4zplj066ey,119,euchre,0,2016-03-12T20:01:02Z,4,1470666827177,the title says it
1725,ilphftp5oo32xq,173,euchre,0,2016-03-12T18:45:28Z,6,1470666827432,what does operator mean has this been covered in the lecture or will it be covered in future
1724,ilpdlwv661z401,366,euchre,0,2016-03-12T16:58:14Z,9,1470666827683,hi im a little confused about how to set up our tests in project 4 the spec references up to 5 files that we an submit for each class my confusion is what exactly each file should test like would we write one file to test all the functions relating to the bools in cardh isface istrump etc or would we write an entire file for just one function i realize that we could put them all in one file but obviously this would become a hassle for larger projects so im assuming thats why were learning to split them up like this also im assuming that we would only have one main function in a central test case that would then call all the other tests files any clarification would be appreciated thanks
1721,ilpatglfvg1xm,93,image,0,2016-03-12T15:40:07Z,4,1470666828388,i need a partner for the code review my email is mlsantizumichedu
1720,ilopvrcirag72n,240,euchre,0,2016-03-12T05:54:03Z,9,1470666828603,what is the difference between getsuit and getsuittrump how can the trump input change the suit of the card
1716,ilomcea36yj2l9,210,euchre,0,2016-03-12T04:15:00Z,8,1470666829502,im a little confused about shuffling it seems like you just keep switching which half is on top can someone describe it maybe an example with fewer card
1714,ilojb200sn370t,142,euchre,0,2016-03-12T02:49:59Z,6,1470666830361,at the start each player has 5 cards and there are four cards remaining which means 24 cards in total also what exactly do you mean by suit there is too much of card game terminology used in the video
1713,iloj4sv83iq6us,160,euchre,0,2016-03-12T02:45:07Z,6,1470666830601,if not will there be videos explaining other types of games as well
1711,ilmj3re378l37m,122,image,1,2016-03-10T17:08:46Z,4,1470666831103,when is the code review document for project three going to be released
1710,ilmiarokytzqn,630,euchre,0,2016-03-10T16:46:14Z,14,1470666831317,refer to this post for faqs related to project 4 if youre new to the game check out post 1709 for some tutorials pin
1709,ilmi17ozecn76i,425,euchre,5,2016-03-10T16:38:48Z,4,1470666831563,for those of you who may be new to euchre or who just want to check out a video version of the simple player example in the spec heres a video that i made to demonstrate it last term httpswwwyoutubecomwatchvm0jgj0nrcrc the videos a little long since it contains a good amount of pictures and explaining text but feel free to use the speed settings or jump around to get what you need the video has a youtube soundtrack but no other sound if youd rather you should be able to download a copy of the source powerpoint 134 mb here httpsdrivegooglecomopenid0bvmvpmyraxvavfjqnhux09intg going to office hours during the first part of the euchre project should be a good way to get in on a few more practice games of euchre and ask any followup questions you have have fun learning euchre and good luck with the project
1707,illvmtm2f3q39w,143,euchre,0,2016-03-10T06:11:45Z,5,1470666831979,
1704,illqj7svr6q1b9,105,recursion,1,2016-03-10T03:48:59Z,4,1470666832713,when can we get our style grade for project2
1701,illm88po5kh2n,88,exam,0,2016-03-10T01:48:28Z,4,1470666833441,i dont get why the answer of 2b3 is ello i tried this piece of code in xcode but it doesnt compile
1700,illloonan0q1o5,93,image,0,2016-03-10T01:33:16Z,5,1470666833715,why did this happen this was my error
1697,illky7zt4knvj,93,image,2,2016-03-10T01:12:41Z,5,1470666834473,i accidentally included cstring in resizecpp and forgot to delete it before i submitted but didnt use it at all i just realized that we werent allowed to include cstring at all will this be extremely detrimental to my grade
1696,illkbu63ur36ht,81,image,1,2016-03-10T00:55:17Z,3,1470666834678,i dont have this button and i need to resubmit a file help
1695,illk0y771b74hg,71,image,1,2016-03-10T00:46:49Z,4,1470666834890,when we print the seamcarve photo function from the processing we get a correctly carved photo however when we try to print that same image in our driver the image is not carved please help thank you
1694,illjtz72qw617w,116,image,0,2016-03-10T00:41:23Z,6,1470666835109,im pretty sure i dont go past the end of argv because i check for argc before accessing the members but it seems like my program is operating like argc is always 5 it works fine when a height argument is passed in so argc 5 but not when argc 4 any ideas as to what might be going wrong would be greatly appreciated
1693,illjogxxsom6v8,59,image,0,2016-03-10T00:37:06Z,4,1470666835318,when i try something like this const int size imagewidthsomeimg int arr3size i get the error variable length arrays are a c99 feature werrorwvlaextension how do i make an array and set its size
1692,illj2h8x40b7f1,70,image,0,2016-03-10T00:20:00Z,5,1470666835541,i have no idea how to get the arguments from the compiler as inputs please help
1691,illj2ehor7p72d,64,image,1,2016-03-10T00:19:57Z,4,1470666835785,when i click on the button it does nothing need to change code that is submitted really quick cant do it because of this
1690,illiqd2o10d3ps,78,image,4,2016-03-10T00:10:35Z,3,1470666835996,why the submission is always queued in autograder now
1689,illipa7kqhg7iu,85,image,0,2016-03-10T00:09:45Z,4,1470666836258,error ‘ strcmp ’ was not declared in this scope i have the library included as well why wont this code compile on caen but it compiles on my mac via terminal and also in xcode
1688,illilnqv4ndby,76,image,2,2016-03-10T00:06:56Z,3,1470666836460,i do not have a button to remove my submission and put in my new one it has been queued for a long while now help
1687,illicghbcqi5n1,104,image,0,2016-03-09T23:59:46Z,5,1470666836708,im getting a valgrind error with a massive amount of invalid read and writes mostly associated with matrixinit and the assignment of height and width to the matrix values example 1125000 errors in context 167 of 174 46365 invalid read of size 8 46365 at 0x4c2e25e memcpyglibc214 in usrlib64valgrindvgpreloadmemcheckamd64linuxso 46365 by 0x404a3c imagegetpixelimage const int int imagecpp166 46365 by 0x40526a computeenergymatriximage const matrix processingcpp108 46365 by 0x401f85 testallstdstring int int processingtestscpp60 46365 by 0x401d2f main processingtestscpp34 46365 address 0xffee17b50 is on thread 1s stack 46365 in frame 3 created by testallstdstring int int processingtestscpp48 46365 46365 46365 1218452 errors in context 168 of 174 46365 invalid read of size 8 46365 at 0x4c2e25e memcpyglibc214 in usrlib64valgrindvgpreloadmemcheckamd64linuxso 46365 by 0x404a17 imagegetpixelimage const int int imagecpp165 46365 by 0x40526a computeenergymatriximage const matrix processingcpp108 46365 by 0x401f85 testallstdstring int int processingtestscpp60 46365 by 0x401d2f main processingtestscpp34 46365 address 0xffed23908 is on thread 1s stack 46365 in frame 3 created by testallstdstring int int processingtestscpp48 46365 46365 46365 1499904 errors in context 169 of 174 46365 invalid write of size 8 46365 at 0x4c2e253 memcpyglibc214 in usrlib64valgrindvgpreloadmemcheckamd64linuxso 46365 by 0x404a61 imagegetpixelimage const int int imagecpp167 46365 by 0x40526a computeenergymatriximage const matrix processingcpp108 46365 by 0x401f85 testallstdstring int int processingtestscpp60 46365 by 0x401d2f main processingtestscpp34 46365 address 0xffea46940 is on thread 1s stack 46365 in frame 1 created by imagegetpixelimage const int int imagecpp160 46365 46365 46365 1500012 errors in context 170 of 174 46365 invalid write of size 8 46365 at 0x4c2e253 memcpyglibc214 in usrlib64valgrindvgpreloadmemcheckamd64linuxso 46365 by 0x404a3c imagegetpixelimage const int int imagecpp166 46365 by 0x40526a computeenergymatriximage const matrix processingcpp108 46365 by 0x401f85 testallstdstring int int processingtestscpp60 46365 by 0x401d2f main processingtestscpp34 46365 address 0xffe9526f0 is on thread 1s stack 46365 in frame 1 created by imagegetpixelimage const int int imagecpp160
1686,illhcghcrrj3jv,70,image,2,2016-03-09T23:31:47Z,5,1470666836930,for anyone having issues passing this test check that your dogoutppm is seam carving to be 4x5 i kept failing this test as well and realized i miswrote some code and it was outputting a 5x4 image instead of 4x5 make sure the single input is being inputted to width and not height as small and silly as this may sound it may be the difference between a 67 and 77
1685,illh5ju8bf76jj,83,image,0,2016-03-09T23:26:24Z,4,1470666837157,im getting a 01 on imagepublictest and im not sure why are my tests just not good enough error
1683,illfyw8u2hl1ck,94,image,0,2016-03-09T22:53:14Z,4,1470666837566,so im running the project solely on caen so i dont think its a problem with my stack size but when i try and run processingtestscpp it compiles fine but throws us a segmentation fault so i used gdb to debug and it successfully calls testallprefixdog sizes0x7fffffffe1d0 numsizes1 in main but when it tries to call testrotate inside testall its giving my partner and i a segmentation fault error on the actual line static void testrotateconst image img string prefix the exact error message is testrotateimgerror reading variable cannot access memory at address 0x7fffff57ff78 prefixerror reading variable cannot access memory at address 0x7fffff57ff70 were just confused because it never even calls any of the functions we made and if it does any insight to which one it might be would be awesome thanks
1682,illf12hangx1nl,73,image,4,2016-03-09T22:26:56Z,7,1470666837818,my code has worked 100 when i have tested it on my machine and on caen the only thing im missing on the autograder is this test heres what its saying resizedog4x5public return code incorrect score for resizedog4x5public total 01 not much to go off of any advice on what might be the problem or where to look in my code that will affect this test and no other
1681,illevfo7zwxu9,75,image,2,2016-03-09T22:22:33Z,4,1470666838061,i finished my resize but i am still running into problems with the autograder my output file is correct when tested with dog 4x5 but im getting 00 on the autograder anyone have any ideas on what could be going wrong or anything i could be missing thank you very much
1680,illebvhztbd6so,126,image,0,2016-03-09T22:07:21Z,6,1470666838302,im debating with a friend both of our code works but one of us thinks resize should be atoi and the other things stoi atoi if command line arguments are cstrings and stoi if they are strings which is better for resize and why are both working thanks saul
1678,illcwclaebt1t5,85,image,0,2016-03-09T21:27:17Z,7,1470666838729,so i initialized the image with the given input i checked to see if the output input files can open and checked all of the other mentioned errors after that i used the seam algorithm to adjust the image to the new size what else is there left to do i saw others mentioning printing to an outputfile but im not seeing anything in the specs about that
1677,illcvn9i2v318h,57,image,2,2016-03-09T21:26:44Z,7,1470666838974,we are passing all of the processing tests locally but when we run it on the autograder we fail with this output any ideas why its failing thank you
1676,illculwawhl5if,70,image,0,2016-03-09T21:25:55Z,5,1470666839181,when i try submitting to the autograder i keep getting this error any ideas on how to fix it it wont even take my files
1675,illcpjdm79x41y,58,image,0,2016-03-09T21:21:59Z,4,1470666839426,were having trouble writing the image to the output file provided in our command line argument we tried using imageprint with cout instead of the output filestream and that worked we got the image to print in terminal cout but it doesnt print anything when we try to send it to the file any tips
1674,illcm8jahrp6u7,84,image,1,2016-03-09T21:19:25Z,6,1470666839627,i have run my processing tests image public tests and resize tests in my caen terminal and everything comes out correct however when i run the autograder the imagepublictest processingpublicdog processingpubliccrabster resizedog4x5public all fail i have double checked my stack size to be correct and redownloaded all the test starter files from the project 3 folder furthermore my resized images come out correct because i have checked them using the diff command in my terminal any idea what i might be doing wrong
1673,illbpbr9xch2bq,83,image,0,2016-03-09T20:53:49Z,7,1470666839823,we have an issue where we are passing the tests in processingtestscpp but failing in the autograder we have even checked our resizecpp output to the correct file and they have no differences but we still fail the test for the autograder for the dog test for example anyone run into this issue and have a fix or is this something for the staff to look into
1672,illblb5canu36m,58,image,0,2016-03-09T20:50:42Z,4,1470666840017,hello most of the times i go to the autograder link i get a blank page with nothing but the option to sign out in the top right corner of the screen how do i handle this
1671,illbaaj89ow7c2,70,image,0,2016-03-09T20:42:08Z,5,1470666840262,the autograder is throwing this error which i do not encounter when running on my caen account i do include string at the top of the imagecpp file and imageh contains using namespace std so i have no idea why the autograder thinks im using a variable named string has anyone encountered this
1670,illb9xqcevd2ha,48,image,0,2016-03-09T20:41:51Z,4,1470666840537,if so would it be 0 im trying to create a variable to initialize the largest energy in an image to fill the borders of the energy matrix with im just wondering if i can initialize with 0
1669,illa79d6ivh5nq,60,image,0,2016-03-09T20:11:47Z,4,1470666840827,can anyone link to the post about suggestions for how to make the run time quicker for processing or the other cpp files or just list a few suggestions in the answer thank you
1668,ill9dvlpthm6fw,76,image,0,2016-03-09T19:48:56Z,4,1470666841081,in resizecpp im trying to convert the argument that contains the image file into an input stream for use in the imageinit function using a stringstream but when i send that stringstream into the function call the file name is being sent in and not its contents im running resizeexe horsesppm horses400x250ppm 400 250 from the spec it seems like only the file name in this case horsesppm is being sent in any tips on properly converting the argument into a usable input stream
1666,ill5jyogplj5z8,79,image,0,2016-03-09T18:01:41Z,5,1470666841584,are we required to comment on cpp files that are required to submit
1665,ill3nmeuoiq9p,88,exam,0,2016-03-09T17:08:33Z,5,1470666841822,out of curiosity when should we expect roughly to get our regrade requests returned a set number of days after submission after the project is turned in a long while after the project is done also will we be notified by gradescope or should we just keep checking for our exam score to change thanks
1664,ill2f9wya5f6q2,81,image,0,2016-03-09T16:34:04Z,4,1470666842060,the file has passed the autograder before but now shows this error where could the error be coming from
1663,ill14iaqzm61t8,104,image,1,2016-03-09T15:57:42Z,3,1470666842303,the title says it
1662,ilky1z8uu9k4iv,111,image,0,2016-03-09T14:31:45Z,5,1470666842568,for the autograder in another post it was mentioned that the highest score was a 78 on the autograder im getting a score out of 7 instead of out of 8 was one of the tests removed
1661,ilku6clj4u73ph,99,image,0,2016-03-09T12:43:11Z,4,1470666842803,what exactly does this mean i have tested each function thoroughly on my laptop and on a caen environment yet i still am not able to pass the image tests
1659,ilkhcqnlyi6ri,137,image,0,2016-03-09T06:44:14Z,5,1470666843094,in terminal on my mac i used make resizeexe to create the executable and when i tried to run it using the line from the corrections and clarifications i keep getting segmentation fault 11 i already increased my stack size in terminal what else could the problem be
1657,ilkfnzk745dvp,83,image,0,2016-03-09T05:56:59Z,3,1470666843343,why does imagesetpixelaux width 1 c r temp in rotate left use width1c as the row i keep getting reveresed results
1656,ilkds80094ayz,75,image,0,2016-03-09T05:04:18Z,4,1470666843579,im rerunning my code for processingtests and it keeps giving me this error g o0 g3 wall c fmessagelength0 mmd mp mfprocessingtestsd mtprocessingtestsd o processingtestso processingtestscpp processingtestscpp in function u2018void testseamcarveconst image stdstring int intu2019 processingtestscpp17138 error u2018tostringu2019 was not declared in this scope prefix tostringnewwidth x make processingtestso error 1 it is saying that in processingtests tostring is undeclared i dont understand why there would be an error with this file
1653,ilkcfc64zdk2zf,77,image,0,2016-03-09T04:26:17Z,3,1470666844012,we are printing our cost matrix to the terminal since it is not passing the test in order to figure why it is failing however as seen below it seems to be adding an extra row and column since it is supposed to be a 4x5 matrix for dog
1652,ilkcc30hz6e3jl,77,image,0,2016-03-09T04:23:45Z,3,1470666844214,so on visual studio the processingtestscpp does not run above 162 mb while on the linux environment the program takes about 78 mb of memory in the stack just to get to top of the first call of the function of testall does anyone know whats going on i have screnshots to show that the program outputs my custom cout statement 10 after allocating 78 mb but then segfaults after that
1651,ilkagg4u2tp6e9,61,image,0,2016-03-09T03:31:09Z,4,1470666844416,is it disrespectful to the interface to directly access and modify data members of matrix within the imagecpp file
1650,ilkachqp6zq37m,53,image,0,2016-03-09T03:28:05Z,4,1470666844632,the specification says to find the maximum energy so far and use it to fill in the border pixels does that mean for the first row the top one that all of pixels will have 0 energy since the matrix is initialized to all zeroes
1649,ilk8ssu2nzv1tm,83,image,0,2016-03-09T02:44:46Z,3,1470666844880,is it acceptable if we tested the matrixinit and imageinit functions within tests for other functions eg width height print and did not have separate test cases for them but stated in the comments that the init functions were also being tested
1648,ilk7ktvgene1gr,66,image,0,2016-03-09T02:10:35Z,3,1470666845096,for matrixinit function do we have to fill the matrix with 0 or just initializing matrix with width and height will be enough
1647,ilk695vvjr7494,102,image,0,2016-03-09T01:33:31Z,4,1470666845360,when i check the width and height of the desired widthheight is leq the original width and length i dont know how to obtain the original widthlength can someone tell me how to do that thanks
1646,ilk5sj0alu03a9,93,image,0,2016-03-09T01:20:35Z,4,1470666845623,im failing all the seam carve tests except the one in the dog case i passed all the other tests including remove i wrote the output to a txt file and diffcheckered them but there are way to many differences starting from the second row and i cant sort out whats wrong the seam array is the same as the correct output anyone knows how i can find the bug any thoughts appreciated
1645,ilk5n2c355d2eq,75,image,0,2016-03-09T01:16:20Z,4,1470666845868,in order to respect the interface im using the matrixwidth and matrixheight functions in my computeenergymatrix function as follows int energyw matrixwidthenergy int energyh matrixheightenergy my matrixwidth function is an assert statement which is not causing problems and the following return mat width my processingcpp file fails the dog energy test and ive found that this is happening because energyw and energyh have the values 0 when i use energy width and energy height instead of energyw and energyh all of my tests pass does anyone know why my matrixwidth and matrixheight functions are failing
1644,ilk5hf5zkh242i,73,image,0,2016-03-09T01:11:57Z,4,1470666846073,hello do we have to assert the requirements for arrayslike in findminimalverticalseam where it requires the size of seam is equal or greater than matrix height if so how would we find the size of an array thank you
1642,ilk4mwg0jsl5u6,91,image,0,2016-03-09T00:48:13Z,3,1470666846471,hey when i submit my code to the autograder i get the ouput resizecpp620 fatal error matrixh no such file or directory include matrixh compilation terminated on the resize compilation check why would including matrixh cause thisdont you need it in order to call the seam carve function
1641,ilk49zd8l054lc,85,image,0,2016-03-09T00:38:10Z,3,1470666846696,i have tested my matrixcpp using the the matrixpublictestcpp provided and the code passes without issue but when i submit to the autograder the code fails matrixpublic test is the autograder using a different set public matrix tests or is it the same as the tests provided in the google drive
1640,ilk44gz55xh7di,87,image,0,2016-03-09T00:33:53Z,3,1470666846888,even though horses was removed from the autograder its still possible to pass locally on your system however when i attempt processingtestscpp i obtain the following testing horses remove seampass testing horses seam carve 300x382assertion failed 0 width width maxmatrixwidth function imageinit file imagecpp line 15 so that would mean the public test case doesnt follow the requires i was just wondering what the problem is
1639,ilk3wh0ooe02wq,83,image,0,2016-03-09T00:27:40Z,4,1470666847115,i use matrixnormalize in one of my imageinit functionthe one that takes an image and matrix as parameters however i do not seem to be calling this version of imageinit anywhere in my program and i dont see where it could be useful my program seems to be working fine without it where can this function be useful
1638,ilk3oxdcf1k5ur,79,image,0,2016-03-09T00:21:48Z,4,1470666847325,
1637,ilk3ndrrldv1js,69,image,0,2016-03-09T00:20:36Z,3,1470666847538,hello i convert a jpg image of proper size to a ppm run it through linux and remove comments change the dimensions redownload it to my desktop it shows up as a blank file convert it back to jpg and the file still no longer contains an image but rather a black screen is anyone else experiencing this problem or know why this is happening thanks
1636,ilk2r7bysba295,75,image,1,2016-03-08T23:55:34Z,3,1470666847797,my horse part of processingtestscpp runs 15 seconds on linux however 1 minute on visual studio does that still indicate i have inefficiency ive followed the instruction on faq about efficiency but its still slow on visual studio
